{"artifact_class": "model-instrumentation", "backend": "torch", "byte_identical_structures": ["prompt.json", "tokens.json", "topk_logits.jsonl"], "claim_ids": [], "dtype": "float32", "empirical": true, "evidence_eligible": false, "license_id": "Apache-2.0", "model": "EleutherAI/pythia-70m-deduped", "notes": "No TRIZ claim; sparse artifacts only.", "numeric_tolerance_by_backend_dtype": {"numpy": {"float32": {"atol": 1e-06, "rtol": 1e-05}}, "torch": {"bfloat16": {"atol": 0.01, "rtol": 0.01}, "bool": {"atol": 0.0, "rtol": 0.0}, "float16": {"atol": 0.01, "rtol": 0.01}, "float32": {"atol": 1e-06, "rtol": 2e-05}, "float64": {"atol": 1e-08, "rtol": 1e-08}, "int": {"atol": 0.0, "rtol": 0.0}, "unknown": {"atol": 0.0001, "rtol": 0.0001}}}, "revision": "e93a9faa9c77e5d09219f6c868bfc7a1bd65593c", "run_state": "instrumentation_verified", "structural_artifacts": [{"name": "README.md", "sha256": "0b8eff9fd326d9089f00c4984db07f89a9dac674ae3191a9bc8ae128b8a37580"}, {"name": "config.json", "sha256": "002050231a9b1ec3ac77aa6b9b3bbdc4d923f4068a7dd33b8da72a9bd6ad9a43"}, {"name": "model.safetensors", "sha256": "3da388330e4549156d76b58d6d268c63cd005e9336b4f4d2d378421e7b7a33fd"}, {"name": "special_tokens_map.json", "sha256": "6f50ab5a5a509a1c309d6171f339b196a900dc9c99ad0408ff23bb615fdae7ad"}, {"name": "tokenizer.json", "sha256": "c24618a1b3e6a38167beff1c72cffd126c3a66254347304b50547d12c5f25624"}, {"name": "tokenizer_config.json", "sha256": "70e38394e494931c6f773ba41e19460dd4436526b852207367f04341b4066d3f"}]}
